开通	我想办理加油包
开通	二百元流量包开通
查询	那狒狒话费麻烦你查一下我现在呃花了多少钱
取消	我的五十元基础包想取消掉
查询	就我这个信我的信用度油耗告我能到底欠费能
查询	我想查查都消费什么了
查询	呃麻烦你帮我查一下话费还有多少
取消	你可不可以取消我的十元流量包
开通	我想买三十块钱的流量
取消	我想取消我那个夜间流量
开通	开通国内流量包
具实	大圩人工
开通	九元小时上网套餐办理
查询	返回查话费
查询	查查我还剩多少积分
开通	三百元三十g流量是每个月都可以办理吗
查询	麻烦你帮我查下话费
具实	客服还
查询	手机服务密码是啥
重置	帮我重置下密码
重置	重新设一下宽带密码
查询	呃你好请问一下我那个密这个卡的密码是多少
开通	办理小时流量包
开通	包五十元加油包怎么包
修改	分钟修改
查询	查话费喂
取消	怎么取消夜间流量变成国内流量包
具实	帮我转接一下前台客服代表
办理	办理包
查询	余额够了
具实	返回个短信吧
查询	我手机密码多少
查询	流量查询银行吗
修改	我那个宽带密码能改一下
办理	我银行卡还有一点钱全都充了话费吧
查询	我的通话还剩多少
查询	不能包不用收费请你听好查什么查
查询	海如问一下记录查下流量还有多少啊
办理	给我充五十块钱话费
查询	查下我的积分
办理	给我办理
开通	办理十元流量包手十元流量
办理	给我查一下给我查一下我手机缴费余额到看交
查询	我三月份有没有交过话费
修改	更改服务密码
开通	在哪定五元周末流量
查询	请问月流量还剩多少行行行
办理	我明天再充话费交还有电话开通的
查询	我剩多少分钟了
具实	帮我查下话
开通	你好我开通二十元包三百兆加油套餐
具实	好返回吧还没没有我的到邮寄吧
具实	我需要客服我需要客服密
查询	我半年内交了多少话费呀
办理	话费不够了我要缴费
查询	我这个月还剩多少短信
开通	我要十块钱的流量包
查询	我重听流量查询流量
查询	我充的话费咋还没到呢
查询	套餐剩余还有多少
查询	的手机号
查询	我的手机有没有欠费
开通	怎么包加油包
重置	重新设置个上网密码
修改	我怎么改下宽带的密码
开通	办理加油包三十元加油包
查询	我都有哪些业务
开通	怎样办理三十元流量加油包
具实	人工嗯
查询	帮我看下我有多少积分
取消	流量取消一下
查询	积分积分
开通	三十元国内流量加油包怎么开
开通	开通一百元包五g基础流量包
查询	查帮
取消	取消二十四小时的流量包
开通	有小时包么
修改	我想修改一下手机密码
查询	查查剩余短信条数
咨询	你们宽带都啥价位的
查询	我有积分吗
开通	我办三十块钱五十兆立即生效当月都动取消这
取消	怎样取消一百元的基础流量包
开通	办理三十元流量加油包一个月的
具实	重听噢
取消	我要将我的周末流量包取消掉
重置	我密码忘了啊怎么办
查询	查话费是多少
查询	给我查查我的话费还剩多少
查询	就我那个月租
开通	六元五百兆小时流量怎么发短信购买
查询	看看我钱都花哪去了
开通	没流量了办个加油包
查询	我不知道原来的密码是什么
查询	我查一下余额还有剩多少
查询	我还有多少钱啊我没听到还有多少钱还有多少
开通	我需要十块钱三十兆的十块钱以及桂寨流量
查询	你好我想问一下我的这个主套餐十三十八元是
查询	查查我短信还剩多少条
查询	我这个套餐怎么有一个那个增值业务费呀
开通	开通三百元三十g流量包
修改	你好我能修改手机密码吗
查询	请问一下请问一下我的那话话费话费还剩多少
查询	我网页这个月的话费余额还有多少
查询	我这查流量吗你那查今天的吗
查询	我现在都有什么业务
开通	能开个七十的流量包吗
查询	我刚才充值了多少元
开通	我需要你帮助就是我办流量包这流量包是有的
取消	请取消我的十元夜间流量包
查询	现在是我的手机嗯四g导航查
取消	我要取消二十元包三百兆流量那个套餐
查询	积分呢
具实	返回谢谢
查询	一个月花销话费有多少
取消	请帮我将十元夜间流量包取消
取消	取消我的闲时流量包
查询	开通业务已开通业务
开通	请问全国流量九块钱四小时的有没
查询	我的钱都扣哪了
查询	卡是怎么消费
取消	我要将我的基础流量包取消掉
开通	五元的流量帮我办一个
查询	查一下话费还有多少钱查话费
开通	开通基础流量的方式
开通	我想办理二十元加油包
开通	流量办理请讲有什么什么套餐的服务
开通	夜间流量开通
查询	流量查流量
修改	我怎么改密码
查询	我想把积分兑换成话费
修改	帮我修改下我的宽带密码行不行
办理	退回互派朵拉充值一万一个充值呢
查询	请查询中
取消	你知道取消二百元基础流量包的方法吗
开通	怎么开夜间流量
查询	本机还剩多少条短信
开通	普通基础流量怎么开通
取消	你这里能取消流量加油五十元的吗
查询	我这月话费痘疤的多少
查询	帮我查一下开通了什么业务
咨询	四g融合宽带快么
开通	开通夜间包
查询	给我看看充了多钱
取消	取消取消夜间流量包
开通	如果办理流量包的和什么时候开始生效
具实	请重复一遍
重置	帮我重置一下服务密码
具实	确认转人工
开通	九元流量包四个小时
取消	不是办理加油包退订高中那个人工无聊的服务
开通	包加油包三十元怎么包
具实	重听重听是重听
取消	请将我的十元夜间流量包取消
查询	刚刚充了多少钱
具实	返回
查询	我就查查话费下楼那个还有吗你交话费
查询	我这边多少流量
修改	我有原密码我要修改
开通	专用夜间流量怎么开
取消	我可以取消夜间流量包吗
查询	我就想问一下我的话费重做了退可以退回来
查询	我这个消费了多少钱
查询	查询本月话费
咨询	单品宽带怎么收费
查询	看看我现在有多少积分
查询	看看我剩余流量有多少
开通	加流量包御元街就失效的
办理	能充值话费吗
重置	忘记了本机密钥
查询	我短信剩余的还有多少条
查询	鲟鱼查询开通的业务
查询	查流量查呃查流量
预约	能不能帮我预约下宽带
办理	我密两交话费明天上移动工笔交话费我重说给
开通	二百元国内流量怎么办理
开通	充五十元基础流量包
开通	怎么充值加油包主要是充流量
开通	怎么办二十元加油包流量
查询	查询流量流量
查询	看我这个月花了多钱
开通	全国流量办理
查询	看看我啥时候充的话费
查询	我的剩余分钟数是多少
查询	帮助查
重置	能不能帮我重置下密码
开通	有五十元全国流量加油包吗
查询	欠费多少钱
取消	请帮我将基础流量包取消
查询	服务密码是多少啊
取消	三十元的加油包是个什么玩意赶紧给我取消的
查询	我还有多少流量没用完
查询	你给我查下我充多少钱
查询	这些你报给我一个话费还有多少钱
查询	给我看看流量还有没了
修改	服务密码在哪里改
查询	看我流量还有多少
开通	七十元包三g流量包怎么开
咨询	什么是群组宽带
开通	我想买三百块钱的流量
修改	我想改一个密码
开通	九元一g开通方式
具实	转人工了服务
查询	我这月的手机费还有多少钱
查询	我的这个卡流量是多少每个月的流量是多少
查询	已开通流量查询
查询	还有一个语音通信费是什么意思啊
查询	你好请问一下我的手机开通了什么业务吧
查询	给我查下流量剩多少
办理	办理二十元的
开通	十元开通
开通	有六元的流量包吗给我开一个
取消	我要取消流量
开通	五十元加油包多少流量
取消	把我的十元流量包给取消了
开通	办理五元两天五百兆的流量包
具实	人工服务人工服务人工服务
开通	我我办理一下那个加油包三十元的
开通	开通一百五十元国内流量包
查询	我要查话费五块钱三十兆的石化厅达到二十块
查询	我这个卡有多少积分
取消	请把我办理的九元小时流量包取消
具实	好帮助
查询	帮我查一下话费吧
查询	充了多少话费
查询	给我查询话费
开通	叠加夜间流量包
开通	一百五十元包十g国内的流量套餐
查询	查一下分钟数还有多少
查询	我想查一下流量
取消	退订呀我那个
开通	五十元加油包怎么包
办理	怎么给卡充值话费
具实	呼叫人工台
查询	余额了
取消	取消闲时包
取消	我想取消流量
具实	再来一遍
查询	你可以你你可以帮我查流量吗
查询	查一下流量送多少
查询	查查我的短彩信还剩多少条
开通	三百元包三十个g
查询	我本机话费还有多少
具实	不需要不需要了
具实	你那人工帮助人工帮助台吧呃我爱你拿人工办
查询	嗯查流量
查询	这个月分钟够不够
查询	看看我还剩多少分钟了
查询	现在还有多少分钟
开通	办个五十元流量加油包
取消	可以把夜间流量取消吗
开通	怎样定五十元流量加油包
查询	你好我想知道我的刚才充的流量有没有到账
查询	我本卡的密码是多少
查询	请问一下我还有多少套餐谢谢
查询	我不知道手机有没有开通流量包
修改	我想更换一下我的密码
开通	流量卡办理
开通	我想办个办个这个开流量二十块钱的加油包
查询	优惠减免的是什么
开通	我要我要重新开启流量
查询	这个月花了什么钱
重置	我密码忘了怎么办
查询	我想看我这个手机搞的流量还有多少
查询	我最近一次的缴费记录
查询	我猜想交的话费你给我查查吗
具实	帮我开机
修改	密码应该怎么改
查询	查十元的加油加油包
开通	有三十元流量加油包吗
查询	帮我查一下这个月的话费
开通	给我开个一百块钱的流量
查询	我话费充进去了吗
查询	话费怎么幺零零八六十点师庄发个信息说我的
开通	我那个流量不够用怎么办
取消	已开通的夜间流量包怎样取消
办理	嗯办理夜间套餐
开通	周末流量办理
查询	查话费的
查询	查下这个月的话费
查询	套餐都剩什么了
具实	退出二十的
开通	有没有十元加油包
办理	办理十元
开通	流量套餐怎么变更
取消	能不能取消五十元的基础流量包
修改	帮我改一下我的
查询	我还有多少免费的短信条数
具实	暂时不需要了
重置	宽带密码不记得了重置下
具实	退出吧
查询	怎么找断了你查流量
开通	流量加油包十块的怎么开通
查询	话费还余加油包可以叠
查询	我还有多少短信剩余条数
咨询	移动宽带怎么收费
开通	开通十元一次性加油包
开通	四g套餐一百元包五g数据流量怎样开通
查询	请查本机欠费多少钱
开通	怎么开通夜间流量叠加包
办理	话费不够了怎么交费
查询	上网费八十一块七毛三十八十上网费怎么上网的
具实	呃请帮我重报一遍吧
查询	你给我查一下我的帐单
查询	这月剩多些分钟了
修改	改个新密码
咨询	群组宽带多少钱
办理	给我充电话费用银行卡那种方式
取消	七十元的基础流量包取消一下
查询	请问我话费余额还有多少
咨询	敢不敢把群组宽带给我介绍一下
查询	我还剩多少流量我还剩多少流量
查询	我这个手机有什么业务
查询	我听不懂白鸡不查了话费比奇那我晓得了
查询	机任我用话费一百二十五元
开通	有没有三百元流量
办理	我想把这卡改为最低的月租就是最低月租是多
查询	给我查查都扣啥钱
开通	办理十元流量包
取消	可以取消二百元的基础流量包吗
重置	你帮我重新设一个手机密码
具实	重听重听重听重听重听重听
开通	那是有开通几块钱查比如说
查询	我还有多少积分
查询	请问我这个月的话费余额还有多少
查询	五万多流量剩多少
重置	重新设置一下手机服务密码
办理	我怎样给手机交话费
确认	就是这个
开通	怎么开通一百五十元国内基础流量包
开通	我开通流量一些呢开通流量
查询	我今天这个晚上充了流量收到了没有啊
取消	那个五十元的加油包我真的不想要了呀取消了吧
办理	是不交话费
查询	试过啦查话费
查询	给我查查中了那好了吗查流量我超的流量还有
查询	我短信话费可以了
查询	帮助我查询一下话费
查询	我每月都交话费吗
重置	重置手机服务密码
取消	取消夜间流量包业务
查询	拿开查询流量
查询	唉请帮我查一下
取消	取消一下十元的加油包
查询	看看刚才那笔充值有没有到账
查询	我想查剩余积分
办理	我也手机缴费
查询	看看我得积分还有多少
查询	看我的流量还有多少
具实	夜里把我挂死帮助
开通	能给我开一个十元的流量不
开通	给我开个九块钱的流量
查询	话费充进了多少
开通	我包一百元五g
查询	查询套餐剩余
开通	六元包五百在哪个页面里
查询	我是想问其他费
查询	给我我要查询话费
查询	他人代付费是怎么扣的
查询	有多少结转流量
查询	你给我查我手机还有多少话费
开通	买五元四十八小时五百兆流量
查询	你看我卡上都开了什么业务
重置	重置手机密码
办理	我怎么能给我手机交话费
具实	你可不可以你可不可以帮我查一下
办理	怎么能交电话费啊
查询	我现在用的是什么套餐
查询	你看看我还有多少流量
办理	七十元的套餐如何办理
办理	你可是我手机就交话费来充了一百充了
开通	有六元小时包么
取消	我要取消五元五百兆流量包
查询	我都办理什么了
开通	我想办理三十元国内的流量加油包
开通	我或者是说我就需要流量
查询	密码查询
查询	我这还有剩余的短信吗
开通	办办理十元一百兆的
查询	那你给我查流量
查询	帮我查询一下这个卡的每个月流量套餐是多少
取消	帮我取消闲时流量包
查询	客服查入话费你你帮我你你给我说啊
查询	嗯查流量查流量
查询	看一下我的话费剩多少
办理	呃我想帮我那个那个那个月租改成十八的可以
查询	给我查下还有多少流量
开通	夜间流量开启
开通	加油包怎么办
查询	查一下有没有积分了
查询	余额么
查询	查一下短信剩多少没有发
重置	帮我重置我的这个什么密码
开通	我办十块钱加油包
查询	我流量还有多少
查询	请你把我查一下话费吧
开通	开通四g流量
查询	我短信发过来好吧呃那个话费发过来
查询	查查我的话费查查话费请你给我查查话费
开通	办理加油包二十
查询	我还剩多少分钟能使
具实	我人工我储蓄帐户
开通	开通五元两日流量包
查询	我现在流量还有多少
具实	重复办
查询	想查查话费
查询	这张卡还剩下多少分钟
开通	二十元加油包怎么包
查询	帮我查我手机号我的手机号多少
查询	我刚才我看一些查一下我流量用了多少还剩下
取消	多兆怎么退订
取消	嗯关掉
取消	我能不能去下三十元的基础流量包
查询	查话费要价格是的查查话费
查询	帮我查一下还剩多少话费
查询	的支行那边打电话给我我能看到号码
取消	我要取消订单
办理	我要充话费充值卡方式
开通	要开通国内十五g的流量需要多少钱
查询	怎么有一个语音通信费用呢
查询	我这张卡话费剩多少啊
开通	想办个全国加油包
取消	我要取消基础流量
开通	办理这个我把一个十元一百兆
查询	再帮我查询一下看一下我的手机里面有没有其
查询	我话费里面有个补收费是怎么回事
查询	哎呀我说这意思啊我说的余额我充了五十块钱
开通	有没有二十元国内流量加油包
查询	查一下我的充值记录
查询	咨询一下我的话费还有多少
查询	余额那个本微信
查询	你看一下我还剩多少钱
开通	十块的流量有多少
办理	我想交电话费
查询	查计费
查询	查询话费查询话费
开通	开一个七十元国内流量包
开通	你好周末这个五元五百兆的是不是我现在办理了就能立即生效使用了呢
查询	我密码是啥呀
取消	把我十元流量包取消
查询	查询积分
查询	你好我想问一下我那个是这月的话费已用了多
查询	哦我想问一下我这个月流量么用多少了
查询	帮我查一下话费啊
开通	一个月十g流量怎么包
具实	这个不是人工折
查询	我这张卡都有啥业务
查询	剩余还剩余多少钱
查询	的小女孩给我话费查一下好不好
开通	办个五十元流量加油包这个月的
查询	没有你好麻烦你帮我查一下本机号码是多少
开通	你能帮我开通一下十元一百兆的月流量包吗
取消	我不需要九元小时流量包了
查询	你给我查询一下积分
修改	我要改宽带密码
修改	我想修改宽带的密码
开通	办个十元办个十元一百兆的
具实	返回杼役
查询	现在一共用了多少分钟
取消	我想退订夜间流量
查询	套餐剩余多少分钟和流量
查询	我今天晚上有没有充话费
开通	有没有九元四小时的流量包
取消	不小心开了一个二十元的加油包帮我取消了吧
开通	喂你好我想办一个我想吗没买流量
查询	我有没有结转的流量
开通	七十元包三g流量
查询	请把我这个手机流量查一下可以吗
查询	我套餐有一个短彩信费是我自己开通的吗
取消	我想退订那个加油包吗
开通	九元的就使用四个小时的怎么办理
查询	查一下我上个月交了多少钱
开通	七十元可以开多少国内流量
查询	我这个月都有哪些消费
具实	帮助不
开通	帮我办理三十块钱流量加油包
开通	外出国内套餐有加油包吗
查询	手机还有免费通话吗
具实	客服幺零停用
开通	有没有六元四小时的流量包
开通	加流量一三十块钱流量
查询	协议消费差额是什么
查询	帮我看一下刚才的话费交进去了吗
办理	再办一个三个月
查询	请查询手机号码话费是多少
查询	能打多少分钟
查询	我这卡服务密码是多少
取消	把我的十包夜间一g流量取消
查询	我手机密码是多少啊
查询	充话充查询话费
查询	我这个手机套餐里面的短信服务他是怎么服务
取消	十元一g国内闲时流量叠加包如何取消
具实	再报一遍吗
查询	帮助查询套餐剩余多少
开通	五十元基础流量包开通方式
开通	一百元包多少流量
查询	我这张卡里面都有啥
具实	嗯他有是有人工是不是现在看吧我要茶道我现
查询	我上次啥时候充的话费
查询	我卡都开通什么了
查询	查我的话费话费
重置	可不可以帮我重置宽带密码
办理	办理加油
查询	打电话的还有多少
办理	给我交点电话费
开通	十元包一百兆十元包一百兆
修改	我要更改密码
取消	取消十元包一g夜间流量套餐
查询	啊不是不是不是我是我如果说要就我的号码我
咨询	查询宽带业务
开通	开通一百五十元包十g流量叠加包
具实	重听明天的天气天气
预约	怎么办理宽带
开通	你好我的流量包这个月不够用了我相加买加油包就用这一个月行吗
办理	办个十元
办理	我把我的套餐取消掉不要了
查询	还有多少免费的分钟数
办理	我这手机怎么充值
重置	密码忘了怎么整
开通	我想买一百五十块钱的流量
查询	请问一下我这这卡流量还有多少
开通	我想办个加油包怎么办呢
查询	话费扣哪儿了
查询	这月都扣什么了
查询	帮我查询现在有多少流量
取消	怎么取消夜间流量包
取消	怎样取消国内夜间流量包
查询	我还有流量吗
开通	七十元包三g国内流量包怎么办
查询	进入查询十元日流量套餐业务
查询	呃查下话费
查询	查我这个月开
查询	我这张卡都有啥开通的
查询	手机初始密码是什么
查询	帮我查一下流量呢
取消	取消二十块钱的流量包
开通	给我开个二十块钱的流量包
修改	修改下密码
重置	重置我得宽带密码
查询	话费情况
具实	那石柱我行帮助
办理	我想换一个套餐
查询	流量查流量查流量
开通	开通四十元加油包
查询	帮我查询查一下话费
查询	给我查查剩余多少流量
咨询	移动的宽带怎么收钱的
查询	套餐里面还有啥
重置	服务密码忘记了
开通	能给我开一个一百五十元的流量不
查询	消费多少钱
办理	帮我充值点话费
查询	查一下吗
查询	问一下我这个套餐及固定费多少钱
具实	我要退出我那个幺哈
查询	请帮我查一查要
查询	将本机号码发送到我的手机上
开通	怎么办理六元五百兆流量包
具实	请给我转人工台
查询	你帮我查一下我今天交了三十元
查询	我要呼叫呼叫不话费邓楼那个还没出来的现在
查询	楚店套餐查询
取消	我的夜间流量怎么取消
修改	我想改一下我密码
查询	查询当前多少钱
取消	呃业务退订
开通	我要加油包
开通	你好五十元二g国内流量怎么开通
具实	帮助你
具实	麻烦你再给我报一遍
取消	帮我取消了为什么都是骗人的
修改	你好请帮我修改手机密码
查询	查询一下我的短信剩余情况
查询	查流量裱画开流量啊查流量
咨询	群组宽带的价格
查询	我说现在我每个月多少兆流量
开通	人家w有没保有把那个人行办理流量加油包
查询	谢谢查话费
查询	密码是啥
取消	退订业务吗喂你好幺零六
开通	办理三十元的
咨询	你们移动的群组宽带是个什么玩意
查询	我这个花多少钱
开通	开通二百块钱的国内流量
查询	手机给我查下话费
查询	账单
开通	我想买夜间流量应该怎么办理啊
开通	开流量
取消	流量取消小时包
查询	这卡都有啥业务开着呢
查询	呃手机话费
查询	给我看看我这个月账单
查询	我卡都开啥啦
查询	查帐
开通	开通二百元基础流量的方式
查询	可就是这话费怎么手机伤财那个信息量他人两
开通	包办十元流量包
开通	我要办理流量就当天就可以用的是哪一种
查询	流量我查流量
开通	包十元十元
查询	我我这查询话费多长了我到浙江来啦
查询	话费查询话费话费
查询	帮我查询一下还剩多少
查询	已开通余额查
查询	看我剩余流量还有多少
查询	我查查流量还有没有
查询	查账单
具实	帮助唉喂单独关闭包月断送空洞
查询	呃给我查一下话费话费
查询	这套餐还剩多少了
查询	重复余额
修改	我要改个密码
修改	我要修改密码咋改啊
修改	我想修改密码
查询	上月转接流量是哪些有多少
办理	退出交费余额
查询	我需要查一下我的余额
查询	查流量吗
查询	我本机有多少积分
办理	我要手机充值
开通	给我开通十元加油包
开通	再见啊还有多少钱流量办理流量有关吗没流量
开通	开通九元四小时快销包
开通	开通二百元包十五g流量叠加包
查询	给我十块给我话费查一下
开通	怎么办理二天用的流量包
办理	哦喂那个手机缴费啊
查询	嗯手机话费还剩多少
查询	我剩多少流量
查询	请帮我查一下那个手机的套餐
取消	二十元的那个流量包不要了赶紧取消吧
查询	查流查流量
取消	能不能取消三百元的基础流量包
办理	我要给手机充值
查询	查申请那个套餐就是说瀑河流量跟那个话费呗
查询	请帮我查一下我的话费
查询	我最近有充钱吗
查询	我彩信还有多少条
查询	你帮我查下我数据流量还剩余多少
取消	退业务
开通	能给我开一个五十元的流量不
查询	话费套餐
取消	开通的闲时流量包自动取消吗
查询	帮我查一下消费账单
查询	你给的分钟数还有多少
办理	嗯你好我要办理一百五十元基础套餐
取消	请取消我的流量
查询	你好请帮我话费查一下
开通	帮我开通一个五元五百兆的省内流量短时包
预约	我家里三个号码办理宽带怎么收费
确认	就来这个吧
开通	有四小时一g的流量吗
查询	现在咋就剩十块多
查询	查话费嗯
查询	帮我查一下这个话费还有多少
查询	我的密码给我查一下
开通	想办三十元国内流量的加油包
查询	我看嗯都查一下我的话费余额还有多少
开通	业务办理流量包
查询	手机密码是多些
查询	我卡有什么业务开通
重置	我的手机密码忘了应该怎么办
办理	办理见谅
查询	这月打多少分钟了
开通	办理五元加油包
开通	如何开通十元加油包
修改	我想换个密码行嘛
具实	要人工十五服务
查询	呃手机号多少
查询	查询流量费
修改	我的服务密码能修改吗
开通	我要三十元的流量包
查询	手机业务
查询	我现在还剩多少分钟了
查询	我这月话费怎么不对
开通	三十元包一个g
办理	怎么存话费
开通	帮我开通
查询	此机还有多少费
取消	退出流量包
开通	我想买九块钱的流量
查询	我要查一下话费
具实	不开通了
开通	开通五元夜间流量加油包
修改	我想修改简单的密码
